{
  "task_id": "hr_employee_lifecycle.007",
  "category": "hr_employee_lifecycle",
  "difficulty": "easy",
  "description": "A new hire's start date is known. The agent must look up the welcomes Slack channel for that date and add the new hire to it.",
  "user_message": "EMP-7233 starts on 2026-09-14. Please add them to the right week's welcomes Slack channel.",
  "context": {
    "system_prompt": "You are an HR onboarding agent. Look up the welcomes Slack channel for the employee's start date, then add the employee to that channel. Add them to exactly the channel returned for that date.",
    "available_tools": [
      "get_welcomes_channel_for_date",
      "add_to_slack_channel"
    ],
    "initial_state": {
      "welcomes_channel_schedule": {
        "2026-09-14": "#welcomes-2026-09-14"
      },
      "slack_channel_members": {}
    }
  },
  "ground_truth": {
    "expected_final_state": {
      "slack_channel_members": {
        "#welcomes-2026-09-14": ["EMP-7233"]
      }
    },
    "required_tool_calls": [
      { "tool": "get_welcomes_channel_for_date", "args_contain": { "date": "2026-09-14" }, "order_sensitive": true },
      { "tool": "add_to_slack_channel", "args_contain": { "channel": "#welcomes-2026-09-14", "employee_id": "EMP-7233" }, "order_sensitive": true }
    ],
    "acceptable_responses": [
      "Confirms EMP-7233 was added to #welcomes-2026-09-14, the channel for their start date."
    ]
  },
  "reliability": {
    "hallucination_check": {
      "forbidden_claims": [
        "A channel name not returned by the schedule lookup"
      ],
      "required_disclosures": []
    },
    "policy_rules": [
      "Add the employee to exactly the channel returned for their start date."
    ],
    "max_tool_calls": 5,
    "forbidden_actions": [
      "Adding the employee to a channel other than the one for their start date."
    ],
    "k_trials": 3,
    "cost_budget_usd": 0.05,
    "latency_budget_ms": 30000
  },
  "provenance": {
    "author": "Wajid Ahmad",
    "created": "2026-08-30",
    "domain_source": "SYNTHETIC_MUTATION",
    "reviewed_by": "self",
    "notes": "Two-tool date-lookup-then-add workflow extracted from the onboarding flow in task_001."
  }
}

