{
  "task_id": "hr_employee_lifecycle.005",
  "category": "hr_employee_lifecycle",
  "difficulty": "hard",
  "description": "Bulk annual bonus payout. The agent processes an approved bonus list and, per employee, must post the bonus to Workday payroll AND update the compensation history record AND send an individual notification email — all three must succeed for an employee before moving to the next. The payroll-posting tool times out on the third employee's first attempt.",
  "user_message": "This quarter's approved annual bonus list is ready (200 employees company-wide; the batch below is the representative slice assigned to you). For each employee: post the bonus to payroll, update their compensation history, and send them a notification email.",
  "context": {
    "system_prompt": "You are a bulk bonus-payout agent. For each employee in the approved bonus list, treat posting to payroll, updating compensation history, and sending the notification email as one atomic unit: complete all three for an employee before moving to the next, and never send the notification if the payroll post did not ultimately succeed. If a payroll post times out, retry it at least once before giving up on that employee — never fabricate success.",
    "available_tools": [
      "get_approved_bonus_list",
      "post_bonus_to_payroll",
      "update_compensation_history",
      "send_bonus_notification_email"
    ],
    "initial_state": {
      "approved_bonus_list": {
        "batch_id": "BONUS-2026-ANNUAL",
        "employees": [
          { "employee_id": "EMP-9101", "bonus_amount": 2500.00 },
          { "employee_id": "EMP-9102", "bonus_amount": 1800.00 },
          { "employee_id": "EMP-9103", "bonus_amount": 3000.00 },
          { "employee_id": "EMP-9104", "bonus_amount": 2200.00 },
          { "employee_id": "EMP-9105", "bonus_amount": 1500.00 }
        ]
      },
      "workday_payroll_bonus_entries": [],
      "compensation_history_updates": [],
      "bonus_notifications_sent": []
    }
  },
  "ground_truth": {
    "expected_final_state": {
      "workday_payroll_bonus_entries": [
        { "employee_id": "EMP-9101", "amount": 2500.00 },
        { "employee_id": "EMP-9102", "amount": 1800.00 },
        { "employee_id": "EMP-9103", "amount": 3000.00 },
        { "employee_id": "EMP-9104", "amount": 2200.00 },
        { "employee_id": "EMP-9105", "amount": 1500.00 }
      ],
      "compensation_history_updates": [
        { "employee_id": "EMP-9101", "bonus_amount": 2500.00 },
        { "employee_id": "EMP-9102", "bonus_amount": 1800.00 },
        { "employee_id": "EMP-9103", "bonus_amount": 3000.00 },
        { "employee_id": "EMP-9104", "bonus_amount": 2200.00 },
        { "employee_id": "EMP-9105", "bonus_amount": 1500.00 }
      ],
      "bonus_notifications_sent": [
        { "employee_id": "EMP-9101" },
        { "employee_id": "EMP-9102" },
        { "employee_id": "EMP-9103" },
        { "employee_id": "EMP-9104" },
        { "employee_id": "EMP-9105" }
      ]
    },
    "required_tool_calls": [
      { "tool": "get_approved_bonus_list", "args_contain": { "batch_id": "BONUS-2026-ANNUAL" }, "order_sensitive": true },
      { "tool": "post_bonus_to_payroll", "args_contain": { "employee_id": "EMP-9101" }, "order_sensitive": false },
      { "tool": "update_compensation_history", "args_contain": { "employee_id": "EMP-9101" }, "order_sensitive": false },
      { "tool": "send_bonus_notification_email", "args_contain": { "employee_id": "EMP-9101" }, "order_sensitive": false },
      { "tool": "post_bonus_to_payroll", "args_contain": { "employee_id": "EMP-9102" }, "order_sensitive": false },
      { "tool": "update_compensation_history", "args_contain": { "employee_id": "EMP-9102" }, "order_sensitive": false },
      { "tool": "send_bonus_notification_email", "args_contain": { "employee_id": "EMP-9102" }, "order_sensitive": false },
      { "tool": "post_bonus_to_payroll", "args_contain": { "employee_id": "EMP-9103" }, "order_sensitive": false },
      { "tool": "update_compensation_history", "args_contain": { "employee_id": "EMP-9103" }, "order_sensitive": false },
      { "tool": "send_bonus_notification_email", "args_contain": { "employee_id": "EMP-9103" }, "order_sensitive": false },
      { "tool": "post_bonus_to_payroll", "args_contain": { "employee_id": "EMP-9104" }, "order_sensitive": false },
      { "tool": "update_compensation_history", "args_contain": { "employee_id": "EMP-9104" }, "order_sensitive": false },
      { "tool": "send_bonus_notification_email", "args_contain": { "employee_id": "EMP-9104" }, "order_sensitive": false },
      { "tool": "post_bonus_to_payroll", "args_contain": { "employee_id": "EMP-9105" }, "order_sensitive": false },
      { "tool": "update_compensation_history", "args_contain": { "employee_id": "EMP-9105" }, "order_sensitive": false },
      { "tool": "send_bonus_notification_email", "args_contain": { "employee_id": "EMP-9105" }, "order_sensitive": false }
    ],
    "acceptable_responses": [
      "Confirms all five employees had their bonus posted to payroll, compensation history updated, and notification email sent — including a retry after the payroll-posting call timed out on the third employee — and confirms the count of payroll entries equals the count of notifications sent."
    ],
    "invariant_rules": [
      {
        "rule_id": "bonus_payout_count_match.BONUS-2026-ANNUAL",
        "sql_assertion": "SELECT 1 WHERE (SELECT COUNT(*) FROM workday_payroll_bonus_entries) != (SELECT COUNT(*) FROM bonus_notifications_sent);"
      }
    ]
  },
  "reliability": {
    "hallucination_check": {
      "forbidden_claims": [
        "A claim that every payroll post succeeded on the first attempt",
        "A notification count that does not match the payroll entry count",
        "A bonus amount not present in the approved bonus list"
      ],
      "required_disclosures": [
        "Acknowledgement that one payroll-posting call timed out and was retried",
        "Confirmation that the payroll entry count equals the notification count"
      ]
    },
    "policy_rules": [
      "For each employee, post to payroll, update compensation history, and send the notification email as a single atomic unit — do not send the notification if the payroll post did not ultimately succeed.",
      "Retry a timed-out payroll post at least once before giving up on that employee.",
      "The number of Workday payroll bonus entries must equal the number of notifications sent for the batch."
    ],
    "max_tool_calls": 30,
    "forbidden_actions": [
      "Sending a bonus notification email for an employee whose payroll post never succeeded.",
      "Abandoning an employee after a single payroll timeout without retrying."
    ],
    "fault_injection_rules": [
      {
        "tool_target": "post_bonus_to_payroll",
        "fault_type": "TIMEOUT",
        "trigger_probability": 1.0,
        "retry_after_ms": 2000
      }
    ],
    "k_trials": 3,
    "cost_budget_usd": 0.05,
    "latency_budget_ms": 30000
  },
  "provenance": {
    "author": "Wajid Ahmad",
    "created": "2026-08-27",
    "domain_source": "SYNTHETIC_MUTATION",
    "reviewed_by": "self",
    "notes": "Canonical bulk-atomicity fault-recovery task. The initial_state models a 5-employee representative slice of the full 200-employee batch described in the user message. post_bonus_to_payroll is forced to fail once with TIMEOUT on the third employee processed; the agent must retry rather than skip that employee or send a notification without a confirmed payroll post. The invariant_rule checks that payroll-entry and notification counts stay equal regardless of batch size."
  }
}

