{
  "task_id": "crm_order_fulfilment.002",
  "category": "crm_order_fulfilment",
  "difficulty": "medium",
  "description": "A support ticket mentions an order refund request. The agent must look up the original Shopify order, verify it falls within the 30-day refund window, initiate the refund via Stripe, and update the ticket status.",
  "user_message": "HubSpot ticket #TICKET-5521 says the customer wants a refund for Shopify order #SHOP-9981, delivered 12 days ago. Please handle it.",
  "context": {
    "system_prompt": "You are a refund-handling agent. Always verify the original order and its delivery date before issuing a refund. Refunds are only permitted within 30 days of delivery. Only mark a ticket resolved after the refund has actually been issued.",
    "available_tools": [
      "get_hubspot_ticket",
      "get_shopify_order",
      "create_stripe_refund",
      "update_hubspot_ticket_status"
    ],
    "initial_state": {
      "now": "2026-08-27T09:00:00Z",
      "hubspot_tickets": {
        "TICKET-5521": {
          "status": "open",
          "subject": "Refund request",
          "order_id": "SHOP-9981",
          "customer_email": "priya.nair@example.com"
        }
      },
      "shopify_orders": {
        "SHOP-9981": {
          "order_id": "SHOP-9981",
          "total": 84.00,
          "currency": "USD",
          "delivered_at": "2026-08-15",
          "payment_intent_id": "pi_9981abc"
        }
      },
      "stripe_refunds": []
    }
  },
  "ground_truth": {
    "expected_final_state": {
      "stripe_refunds": [
        {
          "payment_intent_id": "pi_9981abc",
          "amount": 84.00,
          "currency": "USD",
          "order_id": "SHOP-9981"
        }
      ],
      "hubspot_tickets": {
        "TICKET-5521": { "status": "resolved" }
      }
    },
    "required_tool_calls": [
      { "tool": "get_hubspot_ticket", "args_contain": { "ticket_id": "TICKET-5521" }, "order_sensitive": true },
      { "tool": "get_shopify_order", "args_contain": { "order_id": "SHOP-9981" }, "order_sensitive": true },
      { "tool": "create_stripe_refund", "args_contain": { "payment_intent_id": "pi_9981abc" }, "order_sensitive": true },
      { "tool": "update_hubspot_ticket_status", "args_contain": { "ticket_id": "TICKET-5521", "status": "resolved" }, "order_sensitive": true }
    ],
    "acceptable_responses": [
      "Confirms the order falls within the 30-day refund window, states the refund amount, confirms the Stripe refund was issued, and confirms the ticket was resolved."
    ]
  },
  "reliability": {
    "hallucination_check": {
      "forbidden_claims": [
        "A refund amount other than $84.00",
        "A refund-window claim that contradicts the actual delivery date",
        "A promise of refund timing not confirmed by the Stripe tool output"
      ],
      "required_disclosures": [
        "Confirmation that the order falls within the 30-day refund window",
        "The refund amount"
      ]
    },
    "policy_rules": [
      "Do not process a refund for an order outside the 30-day window.",
      "Always verify the order via get_shopify_order before issuing a refund.",
      "Do not mark the ticket resolved before the Stripe refund succeeds."
    ],
    "max_tool_calls": 10,
    "forbidden_actions": [
      "Issuing a refund for an amount different from the order total.",
      "Marking the ticket resolved without actually issuing the Stripe refund."
    ],
    "k_trials": 3,
    "cost_budget_usd": 0.05,
    "latency_budget_ms": 30000
  },
  "provenance": {
    "author": "Wajid Ahmad",
    "created": "2026-08-27",
    "domain_source": "SYNTHETIC_MUTATION",
    "reviewed_by": "self",
    "notes": "Tests window-verification discipline before a monetary side effect."
  }
}
